{
  "critique_category": "exposure",
  "reasoning": "the render is flat",
  "confidence": 0.3,
  "proposed_fix": {
    "kind": "curves",
    "points": [
      [
        0,
        20
      ],
      [
        64,
        80
      ],
      [
        192,
        200
      ],
      [
        255,
        255
      ]
    ]
  },
  "footprint_pct": 60
}